S.no,Question,Reply
1,What is Bignalytics?,"Bignalytics is a prominent training institute located in Indore, Madhya Pradesh, specializing in high-demand fields of the 21st century. We offer comprehensive courses in Data Science, Machine Learning, Artificial Intelligence, and Data Analytics, designed to equip students with the skills and knowledge necessary to excel in these rapidly evolving industries. Our focus is on providing practical, industry-relevant training that bridges the gap between academic learning and real-world application."
2,Where is Bignalytics located?,"Bignalytics is strategically located at 406, Bansiwala Tower, Sapna Sangeeta Road, in the bustling city of Indore, Madhya Pradesh, India. This location provides easy accessibility for students within the city and the surrounding areas, fostering a conducive learning environment."
3,How can I contact Bignalytics?,"You can easily get in touch with Bignalytics through multiple channels. For direct communication, you can call us at 093992-00960. Alternatively, you can send us an email at contact@bignalytics.in for any queries or detailed information you may need. We strive to be responsive and provide timely assistance to all inquiries."
4,Does Bignalytics offer online courses?,"Yes, Bignalytics understands the diverse needs and preferences of our students. Therefore, we offer both online and offline classroom training options. Our online courses provide flexibility and convenience, allowing you to learn from the comfort of your home, while our offline classroom sessions offer a traditional learning experience with direct interaction with instructors and peers. This blended approach ensures that you can choose the learning mode that best suits your lifestyle and learning preferences."
5,Who are the trainers at Bignalytics?,"At Bignalytics, we take pride in our highly qualified and experienced trainers. Our faculty comprises IITians and PhD professionals who bring a wealth of knowledge and expertise to the classroom. With over 20 years of industry experience, our trainers provide valuable insights, practical guidance, and mentorship to our students, ensuring a high-quality learning experience that prepares them for the demands of the industry."
6,What courses are offered at Bignalytics?,"Bignalytics offers a diverse range of courses designed to cater to the growing demand for skilled professionals in cutting-edge technologies. Our course offerings include Data Science, Machine Learning, Artificial Intelligence, Data Analytics, Python Programming, Generative AI, and Power BI. Each course is structured to provide in-depth knowledge, hands-on experience, and industry-relevant skills, empowering students to build successful careers in their chosen fields."
7,What is covered in the Advanced Data Analytics course?,"The Advanced Data Analytics course at Bignalytics is designed to provide a comprehensive understanding of the data analytics process and equip students with the tools and techniques necessary to excel in this field. The curriculum covers Python for data analysis, SQL for database management, Power BI for data visualization, Excel for data manipulation, ETL processes for data integration, statistics for data interpretation, business intelligence for strategic decision-making, and reporting for effective communication of insights. This comprehensive coverage ensures that students develop a holistic skill set that is highly valued in the industry."
8,What skills will I learn in the Data Science & Analytics course?,"The Data Science & Analytics course at Bignalytics is meticulously structured to provide you with a robust skill set that is highly valued in the data science industry. You will gain proficiency in essential programming languages like Python and R, which are the workhorses of data analysis and statistical computing. You'll also master SQL for effective database management and data retrieval. Furthermore, the course delves into the core concepts of machine learning and deep learning, enabling you to build predictive models and extract meaningful insights from complex datasets. We also cover big data technologies to handle large-scale data processing and business intelligence tools to visualize and communicate data-driven findings effectively."
9,Do I need prior programming experience?,"At Bignalytics, we believe in making our courses accessible to everyone who has a passion for learning. While prior programming experience is not mandatory, and we do offer beginner-friendly courses, having a basic understanding of mathematics and logic can be advantageous. These foundational skills can help you grasp the core concepts more easily and enhance your overall learning experience. However, our experienced instructors are committed to guiding students from all backgrounds and skill levels, ensuring that everyone has the opportunity to succeed."
10,Is there a specialization in AI & Machine Learning?,"Yes, Bignalytics offers a specialized AI & Machine Learning course designed to provide in-depth knowledge and skills in this cutting-edge field. This comprehensive program covers a wide range of advanced topics, including deep learning, Natural Language Processing (NLP), computer vision, reinforcement learning, and AI ethics. Students will gain a deep understanding of the theoretical concepts and practical applications of AI and machine learning, preparing them for specialized roles in this rapidly growing domain."
11,What are the class timings?,"Bignalytics is committed to providing flexible learning schedules to accommodate the diverse needs of our students. Classes are held from Monday to Saturday, between 11 AM and 8 PM. This extended schedule allows students to choose timings that suit their personal and professional commitments, ensuring a convenient and accessible learning experience."
12,How often are classes conducted?,"To ensure a balanced and effective learning experience, Bignalytics conducts courses three days a week. In addition to classroom sessions, we also emphasize practical application through lab sessions, which are held on the remaining days. This combination of theoretical instruction and hands-on practice allows students to reinforce their learning, develop practical skills, and gain real-world experience."
13,Can I visit the institute for practice?,"Yes, Bignalytics encourages students to maximize their learning experience by providing access to the institute for daily practice. We believe that hands-on practice is crucial for mastering technical skills, and our facilities are open to students to come in and utilize the resources, work on projects, and reinforce their learning outside of scheduled class hours."
14,Are weekend classes available?,Please note that Bignalytics focuses its instructional schedule from Monday to Saturday. The institute is closed on Sundays to allow for facility maintenance and to provide a day of rest for both students and staff.
15,Is there a trial or demo class?,"Yes, Bignalytics encourages prospective students to experience our teaching methodology and course content firsthand. We offer two free demo classes, providing an opportunity to interact with our instructors, get a feel for the learning environment, and make an informed decision about enrolling in our courses. These demo classes are a valuable way to assess if Bignalytics is the right fit for your learning goals."
16,What are the fees for different courses?,"Bignalytics strives to provide high-quality education at a competitive price point. Our fees for different courses typically range from ₹33,000 to ₹55,500. The exact fee structure may vary depending on the specific course you choose and any applicable discounts or promotions. We recommend contacting our admissions office for the most accurate and up-to-date information on course fees and payment options."
17,Are there any discounts available?,"Yes, Bignalytics believes in making quality education accessible. We offer various discount options, with potential discounts of up to 25% available to eligible students. Additionally, we provide further benefits and incentives for students who opt for lump sum payments. These discounts can significantly reduce the overall cost of your education, making it more affordable to pursue your career goals with Bignalytics."
18,Can I pay in installments?,"Yes, Bignalytics understands that managing educational expenses can be a concern for many students. To provide financial flexibility, we offer EMI (Equated Monthly Installment) options for all our courses. This allows students to pay their fees in convenient monthly installments, making it easier to budget and finance their education without undue financial burden."
19,Is there any scholarship program?,"While Bignalytics currently focuses on providing accessible education through various discount options, there is no official scholarship program explicitly mentioned. However, we are committed to helping students manage the cost of their education through discounts up to 25% and additional benefits for lump sum payments. We encourage students to inquire about available discounts and payment plans to make their education more affordable."
20,What is the refund policy?,"Bignalytics aims to ensure transparency in all its policies. However, specific details regarding the refund policy are not explicitly outlined in the provided information. It is advisable to contact the institute directly for comprehensive information on their refund procedures, eligibility criteria, and any associated terms and conditions. This will help you make an informed decision regarding your enrollment."
21,How are courses delivered?,"Bignalytics employs a blended learning approach to deliver its courses effectively. This includes a combination of live online classes for interactive learning, recorded sessions for flexible review, and hands-on lab work for practical application. This multi-faceted delivery method ensures that students receive a comprehensive and engaging learning experience, catering to different learning styles and preferences."
22,Do I get lifetime access to course materials?,"Bignalytics provides comprehensive course materials to support student learning. While access to these materials is included as part of the course, the duration of access, specifically whether it includes lifetime access, is not explicitly mentioned in the provided information. It is recommended that students confirm the details regarding course material access duration with the institute directly."
23,Are classes recorded?,"Yes, Bignalytics understands that students may occasionally miss scheduled classes due to various reasons. To ensure that students do not fall behind in their learning, recorded lectures are made available. This allows students to catch up on missed sessions, review previously covered material, and reinforce their understanding at their own pace. The availability of recorded lectures adds flexibility and convenience to the learning experience."
24,Do I get hands-on experience?,"Absolutely! At Bignalytics, we strongly believe in the importance of experiential learning. Our courses are designed to provide extensive hands-on experience through a variety of practical methods. You will be actively involved in numerous projects that simulate real-world scenarios, allowing you to apply the concepts you learn in a practical context. We also have dedicated lab sessions where you can experiment, practice, and refine your skills. Moreover, you will work with real-world datasets, giving you valuable experience in tackling the challenges and complexities of actual data. This practical approach ensures that you not only understand the theory but also develop the practical skills necessary to succeed in a data-driven role."
25,Are group discussions or Q&A sessions available?,"Yes, Bignalytics fosters a collaborative and interactive learning environment. Group discussions and Q&A sessions are integral parts of our curriculum. We conduct doubt-clearing sessions to address students' queries and facilitate interactive discussions to encourage peer learning, knowledge sharing, and a deeper understanding of the subject matter. These sessions provide valuable opportunities for students to engage with instructors and fellow learners, enhancing their learning experience."
26,Does Bignalytics provide job placement assistance?,"Yes, Bignalytics is committed to supporting its students in their career aspirations. The institute offers 100% placement assistance to help graduates secure relevant job opportunities. Our placement support includes resume building, interview preparation, and connecting students with potential employers. We strive to equip our students with the skills and confidence they need to succeed in their job search and launch successful careers."
27,What kind of companies hire Bignalytics students?,"Bignalytics has a strong track record of placing its graduates in reputable companies across various industries. Some of the companies that have hired Bignalytics students include TCS, MapMyIndia, SmartGig, and BrainSight AI. These companies represent a diverse range of sectors, demonstrating the broad applicability of the skills and knowledge acquired through Bignalytics's training programs."
28,What is the average salary of graduates?,"Bignalytics graduates have demonstrated strong earning potential in the job market. While salaries can vary depending on factors such as the specific role, individual skills, and prior experience, the typical salary range for our graduates is between ₹3 LPA (Lakhs Per Annum) and ₹14.5 LPA. This salary range reflects the value and demand for the skills and expertise that Bignalytics equips its students with."
29,Do you offer resume-building support?,"Yes, Bignalytics provides comprehensive career support to its students, including guidance on resume building, LinkedIn profile optimization, and interview preparation. We understand that a well-crafted resume and a strong online presence are essential for a successful job search. Our career services team works closely with students to help them create compelling resumes, optimize their LinkedIn profiles, and develop effective interview skills, enhancing their employability and increasing their chances of securing desirable job opportunities."
30,Is there a job guarantee?,"While Bignalytics is dedicated to supporting its students in their job search through strong placement assistance, an explicit job guarantee is not mentioned in the provided information. However, our comprehensive career support services, industry-relevant curriculum, and strong industry connections significantly enhance our graduates' employability. We focus on equipping students with the skills, knowledge, and confidence they need to succeed in the job market and achieve their career goals."
31,What programming languages are covered?,"Python, R, and SQL are the main languages taught."
32,Do courses include Power BI or Tableau?,"Yes, Power BI is included, and Tableau is covered in some courses."
33,What machine learning frameworks are used?,"Scikit-learn, TensorFlow, and PyTorch are used for AI & ML courses."
34,Do I need a high-end laptop for the course?,A laptop with at least 8GB RAM and a good processor is recommended.
35,Will I work on real datasets?,"Yes, students get hands-on experience with real-world datasets."
36,Will I receive a certificate after completing the course?,"Yes, a certification of completion is provided."
37,Is the certification industry-recognized?,"Yes, it is recognized by various companies in the data analytics and AI industry."
38,Are there exams or assessments?,"Yes, students undergo assessments, projects, and mock tests."
39,Can I use the certification to get a job abroad?,"While helpful, additional global certifications may be required."
40,Does Bignalytics offer international certification exams?,"No, but the courses prepare students for industry-recognized exams."
41,Does Bignalytics help in career transitions?,"Yes, many students transition from non-tech backgrounds to data-related roles."
42,Do you offer networking opportunities?,"Yes, networking sessions and industry expert talks are conducted."
43,What is the success rate of students getting jobs?,A significant percentage of graduates secure jobs within a few months.
44,Can freshers enroll in the course?,"Yes, freshers with no prior experience can enroll."
45,Do you provide soft skills training?,"Yes, communication and interview skills are covered."
46,What is the eligibility to enroll?,"Anyone with an interest in data science, AI, and analytics can enroll."
47,Can working professionals join?,"Yes, many working professionals take courses to upskill."
48,Is there a mobile app for course access?,"No, but courses are accessible via desktop and mobile browsers."
49,Do I need an internet connection for online courses?,"Yes, a stable internet connection is required."
50,Can international students enroll?,"Yes, but contact Bignalytics for admission procedures."
51,How long does it take to complete a course?,"Course durations vary from 6 to 14 months, depending on the program."
52,Can I switch from one course to another after enrollment?,"Yes, but you may need to pay the difference in fees and seek approval from the administration."
53,Does Bignalytics provide course completion certificates?,"Yes, every student who completes a course successfully receives a certification."
54,Are the certifications recognized in the industry?,"Yes, certifications from Bignalytics are recognized by various companies in the data science and analytics industry."
55,Do I need to pass an exam to get certified?,"Yes, students need to complete assignments, projects, and assessments to receive certification."
56,Can I enroll in multiple courses at the same time?,"Yes, but it is recommended to focus on one course at a time for better learning outcomes."
57,Is prior experience required for the AI & Machine Learning course?,"No, but knowledge of Python and statistics is beneficial."
58,Does Bignalytics provide soft skills training?,"Yes, soft skills such as communication, teamwork, and problem-solving are included."
59,Will I learn how to deploy AI models?,"Yes, courses cover AI model deployment using Flask, Docker, and AWS."
60,Is there a specific age limit to enroll in a course?,"No, Bignalytics welcomes learners of all ages."
61,Do I need a laptop to take the course?,"Yes, a laptop with at least 8GB RAM and a good processor is recommended."
62,What software tools are covered in the courses?,"Python, R, SQL, Power BI, Tableau, TensorFlow, and Hadoop, among others."
63,Are practice projects included in the curriculum?,"Yes, each course includes hands-on projects to help students gain real-world experience."
64,Do students work on live industry projects?,"Yes, some advanced courses include real-time industry-based projects."
65,Is there any mentorship program available?,"Yes, students receive mentorship from industry experts and faculty."
66,Do you offer guidance for Kaggle and other competitions?,"Yes, students are encouraged to participate in data science competitions."
67,Can I access course materials after course completion?,"Yes, students have access to materials for a limited time post-completion."
68,How can I track my progress in the course?,Regular assessments and project reviews help track student progress.
69,Are one-on-one doubt sessions available?,"Yes, students can schedule one-on-one doubt-solving sessions with mentors."
70,Does Bignalytics provide career counseling?,"Yes, career guidance is provided to help students choose the right path."
71,Are international students eligible for enrollment?,"Yes, international students can enroll in online courses."
72,Do students receive job referrals?,"Yes, Bignalytics connects students with hiring partners for job referrals."
73,Are live coding sessions part of the training?,"Yes, students get hands-on experience through live coding sessions."
74,Do you provide assistance with LinkedIn profile optimization?,"Yes, career support includes LinkedIn profile optimization."
75,Will I learn about cloud platforms?,"Yes, courses cover AWS, Azure, and Google Cloud for cloud-based analytics."
76,Can I interact with alumni for career advice?,"Yes, students can connect with alumni for networking and guidance."
77,Do you provide a free trial for any courses?,"Yes, two demo classes are available for free."
78,What industries hire data science professionals?,"Industries like finance, healthcare, e-commerce, and IT hire data science professionals."
79,Do you provide a printed course certificate?,"Certificates are provided digitally, but printed versions can be requested."
80,Are case studies included in the training?,"Yes, students analyze real-world case studies as part of the learning process."
81,Do you provide mock interviews?,"Yes, mock interviews are conducted to prepare students for job placements."
82,Will I learn about MLOps and model deployment?,"Yes, advanced courses cover MLOps, model deployment, and CI/CD pipelines."
83,What is the average duration of each lecture?,Each lecture typically lasts between 1 to 2 hours.
84,Does Bignalytics have any partnerships with universities?,"Bignalytics collaborates with select universities to offer joint programs and academic credits, enhancing the educational value and providing students with more opportunities. Please contact the institute for specific university partnerships."
85,Are there any industry-specific data science courses?,"Yes, Bignalytics provides specialized data science courses tailored to specific industries such as healthcare, finance, and e-commerce, addressing the unique challenges and data requirements of each sector."
86,How does Bignalytics incorporate the latest industry trends into its curriculum?,"Bignalytics continuously updates its curriculum to reflect the latest industry trends, tools, and technologies through regular reviews, feedback from industry experts, and incorporating emerging topics like Generative AI and cloud computing."
87,What kind of support is provided for students with learning disabilities?,"Bignalytics is committed to providing an inclusive learning environment and offers support services for students with learning disabilities, including personalized attention, flexible learning options, and assistive technologies. Please reach out to the support team for specific accommodations."
88,Does Bignalytics offer any short-term certificate programs or workshops?,"Yes, in addition to long-term courses, Bignalytics conducts short-term certificate programs and workshops on specific topics like Python for beginners, data visualization with Tableau, and machine learning fundamentals."
89,Are there opportunities for students to participate in hackathons or coding competitions?,"Bignalytics encourages students to participate in hackathons and coding competitions, providing guidance, resources, and mentorship to help them showcase their skills and gain practical experience."
90,How does Bignalytics address ethical considerations in AI and data science?,"Bignalytics integrates ethical considerations into its AI and data science curriculum, covering topics like data privacy, algorithmic bias, and responsible AI development to ensure students are aware of and practice ethical principles."
91,What kind of career counseling services are provided to students?,"Bignalytics offers comprehensive career counseling services, including one-on-one sessions, resume reviews, mock interviews, and career guidance workshops to help students define their career goals and develop effective job search strategies."
92,"Does Bignalytics have an alumni network, and how can students benefit from it?","Yes, Bignalytics has an active alumni network that provides mentorship, networking opportunities, and career support to graduates. Students can connect with alumni for industry insights, job referrals, and professional development advice."
93,Are there any opportunities for students to work on open-source projects?,"Bignalytics encourages students to contribute to open-source projects, providing guidance and support to help them gain practical experience, collaborate with other developers, and build their professional portfolio."
94,How does Bignalytics help students prepare for technical interviews?,"Bignalytics conducts technical interview preparation sessions, including mock interviews, coding challenges, and problem-solving exercises, to help students develop the skills and confidence needed to succeed in technical interviews."
95,Does Bignalytics provide any resources for students interested in pursuing higher education in data science or AI?,"Bignalytics offers guidance and resources for students interested in pursuing higher education in data science or AI, including information on university programs, application processes, and scholarship opportunities."
96,What is Bignalytics's approach to teaching programming concepts to beginners?,"Bignalytics uses a beginner-friendly approach to teaching programming concepts, starting with the fundamentals, using visual aids, providing hands-on exercises, and offering personalized support to ensure students grasp the basics effectively."
97,Are there any specific courses on data visualization techniques?,"Yes, Bignalytics offers dedicated courses on data visualization techniques, covering tools like Tableau, Power BI, and Matplotlib, and teaching students how to create effective and insightful visualizations."
98,How does Bignalytics ensure that students stay updated with the latest software and tools?,"Bignalytics ensures that students stay updated with the latest software and tools by incorporating them into the curriculum, providing access to software licenses, and conducting workshops on new technologies."
